{
  "_meta": {
    "generator": "manual backfill by Claude X",
    "note": "PARTIAL PROVENANCE - uv.lock hash recorded at runtime; Lean hashes inferred from git history"
  },
  "experiment_id": "CAL-EXP-1",
  "git_evidence": {
    "commit_range": "f7f80e93109c3aa94778a595018cdd8df7b8a438..a7b073ad7970c9f26f5902b2254ff0f922e4ab5d",
    "lake_manifest_unchanged": true,
    "lean_toolchain_unchanged": true,
    "verification_command": "git log --oneline f7f80e9..HEAD -- backend/lean_proj/lean-toolchain backend/lean_proj/lake-manifest.json"
  },
  "lake_manifest_hash": null,
  "lean_toolchain_hash": null,
  "provenance_level": "partial",
  "run_metadata_ref": {
    "timestamp": "2025-12-13T09:49:49.794979+00:00",
    "verdict": "6/6 PASS"
  },
  "schema_version": "1.0.0",
  "timestamp": "2025-12-13T11:00:00Z",
  "toolchain": null,
  "toolchain_fingerprint": null,
  "uv_lock_hash": "d088f20824a5bbc4cd1bf5f02d34a6758752363f417bed1a99970773b8dacfdc"
}
